94	Furniture; bedding, mattresses, mattress supports, cushions and similar stuffed furnishings; ...	7001328	8591937	9552824	10622790	11103952	11843287	11555749	11017358	10811435	10835329	10245746	8512601	USA
97	Works of art, collectors' pieces and antiques	6498403	6452107	6909174	7387629	7698714	10192997	11030598	11216594	11737081	14559304	12612384	8184377	USA
22	Beverages, spirits and vinegar	3601291	4712807	7814659	6887352	6951945	7626449	7554313	7709180	8297603	8678052	7973158	7732568	USA
44	Wood and articles of wood; wood charcoal	5451492	7076309	7914476	7890641	8963664	9745328	8928099	9022248	9776719	9868241	8323691	7654931	USA
47	Pulp of wood or of other fibrous cellulosic material; recovered (waste and scrap) paper or ...	6801433	8861532	10102766	9311759	8965490	8967772	8703927	8432311	8764657	9393011	8477960	7601602	USA
52	Cotton	4924276	7544221	11067177	8284412	7636779	6521498	5873289	5694143	7635204	8380758	7898906	6996960	USA
34	Soap, organic surface-active agents, washing preparations, lubricating preparations, artificial ...	5013115	5861893	6476646	6860866	7116871	7380187	7109247	6960402	7211063	7267569	6936268	6937720	USA
32	Tanning or dyeing extracts; tannins and their derivatives; dyes, pigments and other colouring ...	5739488	7629810	8826328	8161700	7825310	7966092	7591407	7440857	7858787	7990794	7525792	6752078	USA
26	Ores, slag and ash	3496874	5558831	7700074	7019870	7321029	8362920	6810950	5705531	6011334	6744243	7285187	6509311	USA
74	Copper and articles thereof	5053938	7886532	9654623	9695969	9120831	8664748	7073104	6314653	7183462	8414536	7306068	6452176	USA
04	Dairy produce; birds' eggs; natural honey; edible products of animal origin, not elsewhere ...	1948772	3223273	4113779	4252530	5770114	6164740	4448509	3904739	4476973	4615200	4955623	5417059	USA
95	Toys, games and sports requisites; parts and accessories thereof	6961581	6928635	7202434	7056864	6734939	6594989	6198684	6231103	6904695	6782532	6384570	5361272	USA
70	Glass and glassware	4144818	4996741	5338932	5295622	5602321	5780073	5785593	5762657	5829209	5801333	5545605	4952161	USA
07	Edible vegetables and certain roots and tubers	3400734	3784500	3939248	4044614	4404553	4511544	4362841	4690218	4785976	4503219	4685649	4839377	USA
20	Preparations of vegetables, fruit, nuts or other parts of plants	3499099	3778291	4404190	4750359	5071678	5193694	5425736	5058994	4990335	5076793	4970914	4502981	USA
83	Miscellaneous articles of base metal	3200935	3749441	4138513	4406693	4615521	4929546	4866546	4851178	4853280	5125209	5192088	4349361	USA
93	Arms and ammunition; parts and accessories thereof	3434293	3976384	3936050	4055539	4634801	4550285	5016842	5402536	5283053	5563611	5998415	4295586	USA
19	Preparations of cereals, flour, starch or milk; pastrycooks' products	2850693	3087156	3505309	3887706	4194044	4254565	4280822	4055684	4066085	4158344	4281040	4276457	USA
03	Fish and crustaceans, molluscs and other aquatic invertebrates	3527225	4028222	5082222	5024709	5134103	5256621	5088511	4968660	5393759	5253279	4883256	4010945	USA
82	Tools, implements, cutlery, spoons and forks, of base metal; parts thereof of base metal	3700672	4711937	5392655	5464842	5496735	5459301	4959029	4581990	4652258	4839775	4634822	3900865	USA
35	Albuminoidal substances; modified starches; glues; enzymes	2229118	2709811	2973428	3064813	3276554	3475743	3389982	3394711	3595321	3578267	3687303	3748888	USA
49	Printed books, newspapers, pictures and other products of the printing industry; manuscripts, ...	5462313	5758556	5747146	5700094	5580854	5218463	4861182	4565228	4455787	4335327	4236842	3667793	USA
15	Animal or vegetable fats and oils and their cleavage products; prepared edible fats; animal ...	3503768	4648763	4993033	4627662	3791208	3400967	3167653	3195651	3319106	3160658	3085712	3589233	USA
31	Fertilisers	4131895	4667398	6308950	5378725	5022082	4632289	4394047	3409460	3771414	4169719	4140708	3555681	USA
68	Articles of stone, plaster, cement, asbestos, mica or similar materials	2150643	2829961	3174045	3343968	3512027	3862985	3868871	3875365	3956286	4102462	4018531	3262585	USA
86	Railway or tramway locomotives, rolling stock and parts thereof; railway or tramway track fixtures ...	2221342	2502803	3269556	3848120	3875245	4043671	4183596	3466487	3188298	3373243	3495618	2716650	USA
81	Other base metals; cermets; articles thereof	1778282	2040800	2611946	2720941	2735841	2867798	2696709	2682297	2875847	3181701	3165879	2477678	USA
63	Other made-up textile articles; sets; worn clothing and worn textile articles; rags	1485474	1650142	1894217	1999850	2166122	2226059	2182300	2001634	2138086	2179217	2227602	2458741	USA
56	Wadding, felt and nonwovens; special yarns; twine, cordage, ropes and cables and articles thereof	1695251	2098668	2257364	2295696	2445354	2513067	2372908	2314225	2408880	2480128	2420202	2396432	USA
61	Articles of apparel and clothing accessories, knitted or crocheted	1952870	2169167	2332334	2448879	2645962	2730349	2736480	2611463	2685018	2905524	2965433	2317221	USA
96	Miscellaneous manufactured articles	1163317	1290443	1325913	2176675	2284384	2340067	2320164	2373333	2427964	2546412	2429393	2272530	USA
75	Nickel and articles thereof	1344510	1702240	2231076	2170240	2107338	2205911	2189425	1883751	2006842	2760988	3120255	2212008	USA
25	Salt; sulphur; earths and stone; plastering materials, lime and cement	1622744	2264617	2501860	2616724	2596576	2855832	2681143	2413274	2841252	3009483	2605769	2208187	USA
37	Photographic or cinematographic goods	2777800	2832930	2760977	2573655	2560816	2370759	2364628	2226495	2191916	2219659	2296087	2048010	USA
89	Ships, boats and floating structures	2041853	2629064	2602971	3533868	2677519	3400936	3132696	2342198	2164697	2604579	2370821	1998211	USA
16	Preparations of meat, of fish or of crustaceans, molluscs or other aquatic invertebrates	1525763	1658406	1859174	1965870	2227514	2408903	2298304	2160183	2162382	2186698	2067755	1961980	USA
59	Impregnated, coated, covered or laminated textile fabrics; textile articles of a kind suitable ...	1321848	1745419	1902259	2033215	2115499	2239066	2240474	2198983	2292292	2338029	2150373	1891663	USA
17	Sugars and sugar confectionery	1201243	1741252	2166356	2560100	2476821	2267758	1969469	1915557	2022363	2006370	1931061	1835352	USA
69	Ceramic products	1193217	1523913	1734983	1714202	1765422	1899719	1814240	1730277	1928869	2054613	2103967	1804631	USA
62	Articles of apparel and clothing accessories, not knitted or crocheted	1546496	1821094	2129572	2350755	2419502	2573466	2589333	2337995	2300241	2388531	2248265	1788656	USA
55	Man-made staple fibres	1852249	2257754	2635624	2632975	2741198	2710528	2463788	2239271	2164197	2279988	2212231	1784270	USA
18	Cocoa and cocoa preparations	1161575	1385233	1592860	1717001	1870355	2117070	1948838	2035011	1991055	1935862	1925616	1682692	USA
54	Man-made filaments; strip and the like of man-made textile materials	1189744	1570872	1740539	1754243	1775971	1878510	1789330	1717052	1776904	1765944	1712429	1291651	USA
42	Articles of leather; saddlery and harness; travel goods, handbags and similar containers; articles ...	1131887	1214459	1365039	1539722	1643903	1625095	1684509	1627375	1554022	1695703	1663369	1271399	USA
41	Raw hides and skins (other than furskins) and leather	1863363	2905252	3326712	3233356	3757799	3833706	3187981	2741014	2698190	2209737	1703728	1258251	USA
91	Clocks and watches and parts thereof	780169	918043	1134292	1253767	1230612	1327309	1316791	1250994	1407475	1550828	1658472	1253682	USA
05	Products of animal origin, not elsewhere specified or included	779465	741571	842574	894879	1024331	1236528	1131606	1013436	1150732	1301722	1302786	1149932	USA
64	Footwear, gaiters and the like; parts of such articles	945299	1105454	1290039	1332305	1391432	1455212	1463742	1367745	1432623	1562378	1637035	1136086	USA
24	Tobacco and manufactured tobacco substitutes	1697126	1671102	1695719	1657584	1909887	1805453	2077161	2297815	2179907	2324503	1804660	1047922	USA
09	Coffee, tea, maté and spices	740347	888103	1226518	1295237	1184438	1224983	1217254	1221148	1170105	1148588	1093721	1044968	USA
01	Live animals	796794	814890	1038251	1189530	1019525	944407	758215	783977	1006995	1105392	1027931	965955	USA
11	Products of the milling industry; malt; starches; inulin; wheat gluten	909199	830992	870423	955146	912462	936165	887782	877917	912438	915837	949831	965204	USA
57	Carpets and other textile floor coverings	857872	1006281	1077287	1105466	1125050	1118767	1031985	974400	999212	977845	910870	773428	USA
92	Musical instruments; parts and accessories of such articles	688569	707512	815051	858184	829012	822357	774629	763767	720836	749123	793320	688066	USA
60	Knitted or crocheted fabrics	910922	1062235	1059613	1032260	1075511	1058753	1060797	959751	882424	869481	824870	657142	USA
36	Explosives; pyrotechnic products; matches; pyrophoric alloys; certain combustible preparations	640073	804463	812260	874116	840544	864155	865327	821377	785015	761116	760334	603976	USA
13	Lac; gums, resins and other vegetable saps and extracts	513928	566017	602083	743281	619079	605390	573087	556020	562105	690375	666062	603857	USA
06	Live trees and other plants; bulbs, roots and the like; cut flowers and ornamental foliage	405437	416043	423746	400532	417632	421387	411240	427109	447219	460120	457315	429310	USA
58	Special woven fabrics; tufted textile fabrics; lace; tapestries; trimmings; embroidery	473812	526853	509007	494488	485604	502314	493206	464672	492175	504062	467552	337912	USA
65	Headgear and parts thereof	179441	200429	232940	272702	263825	272910	293750	326155	301271	329219	330336	296624	USA
79	Zinc and articles thereof	186392	289233	323616	395246	322859	443107	348224	505626	451697	424700	363970	264849	USA
43	Furskins and artificial fur; manufactures thereof	207396	289218	423007	614271	702472	583208	533543	373959	287003	200084	144956	158671	USA
78	Lead and articles thereof	242746	186821	179812	154787	189230	207649	158348	126688	168756	291483	148508	151372	USA
80	Tin and articles thereof	129004	222217	243649	197527	189957	207600	157289	155619	149446	150824	162074	144684	USA
67	Prepared feathers and down and articles made of feathers or of down; artificial flowers; articles ...	81292	88391	102704	111383	120831	128422	138397	141953	152716	161185	149505	118227	USA
51	Wool, fine or coarse animal hair; horsehair yarn and woven fabric	83494	87681	84842	84303	99710	83033	86070	66766	75173	76218	60193	45452	USA
66	Umbrellas, sun umbrellas, walking sticks, seat-sticks, whips, riding-crops and parts thereof	18799	22538	30253	31807	29477	32224	33409	32644	38286	36872	39324	33895	USA
14	Vegetable plaiting materials; vegetable products not elsewhere specified or included	60682	168397	97830	48826	55649	32155	31891	29366	39411	38468	27034	28898	USA
53	Other vegetable textile fibres; paper yarn and woven fabrics of paper yarn	21185	23544	19079	17114	16786	20049	22375	19429	20101	19836	17793	21963	USA
46	Manufactures of straw, of esparto or of other plaiting materials; basketware and wickerwork	27688	23094	21324	23597	22121	21161	18407	16620	18161	20502	17668	20525	USA
45	Cork and articles of cork	40284	37806	36098	31126	28936	30571	30963	31491	24696	23407	23248	19464	USA
50	Silk	25620	26349	23611	16867	13485	12584	12641	9808	13097	7962	7405	4457	USA
