40	Rubber and articles thereof	1996	1682	2706	3474	3484	3037	4779	4328	5742	7388	5845	6744	Senegal
74	Copper and articles thereof	8087	8121	11012	11915	21814	20387	15874	11106	10435	6880	7400	6679	Senegal
18	Cocoa and cocoa preparations	2310	2426	7295	4728	5248	5949	5530	7285	7670	8368	7843	6638	Senegal
44	Wood and articles of wood; wood charcoal	1869	3054	5537	6795	6071	5363	5281	6526	7579	7954	5684	6246	Senegal
94	Furniture; bedding, mattresses, mattress supports, cushions and similar stuffed furnishings; ...	1904	3431	3264	4875	5954	3545	3221	8066	4699	3754	5115	6197	Senegal
11	Products of the milling industry; malt; starches; inulin; wheat gluten	3986	6006	5391	7390	7014	6984	9191	6304	5313	7008	5186	5872	Senegal
17	Sugars and sugar confectionery	1894	2113	4786	3027	2423	3374	3298	4048	8036	13540	6705	5348	Senegal
41	Raw hides and skins (other than furskins) and leather	3408	2723	6620	15919	27943	28107	18349	12300	14058	13835	6706	4629	Senegal
63	Other made-up textile articles; sets; worn clothing and worn textile articles; rags	11964	5898	6642	7122	5826	9765	2841	3084	2855	3345	3600	3706	Senegal
56	Wadding, felt and nonwovens; special yarns; twine, cordage, ropes and cables and articles thereof	59	159	145	133	1416	2005	2462	2195	1949	3027	2910	3705	Senegal
88	Aircraft, spacecraft, and parts thereof	80227	863	845	8483	1809	827	1890	777	603	15845	3297	3607	Senegal
30	Pharmaceutical products	13334	10466	11257	13046	11801	13774	10943	20501	9218	11546	8163	3187	Senegal
46	Manufactures of straw, of esparto or of other plaiting materials; basketware and wickerwork	2804	3330	2295	2904	4956	4258	4112	4046	5195	4053	3839	3169	Senegal
13	Lac; gums, resins and other vegetable saps and extracts	1523	1703	3441	3192	3639	3011	2567	2320	2651	1705	1218	2546	Senegal
62	Articles of apparel and clothing accessories, not knitted or crocheted	582	505	395	284	450	2795	676	600	882	262	358	2488	Senegal
82	Tools, implements, cutlery, spoons and forks, of base metal; parts thereof of base metal	947	912	1049	10551	1385	1412	5955	8852	8260	5240	1145	2406	Senegal
81	Other base metals; cermets; articles thereof	0	0	0	26	21	168	9	14	122	283	95	2336	Senegal
09	Coffee, tea, maté and spices	76	125	473	1031	2838	5774	3681	1447	1831	4300	2030	2322	Senegal
54	Man-made filaments; strip and the like of man-made textile materials	1496	698	839	767	1172	1754	1460	663	1280	1802	1675	2047	Senegal
70	Glass and glassware	1275	2084	2390	2408	2029	3003	2475	2439	1677	1991	1871	1898	Senegal
76	Aluminium and articles thereof	4787	4178	4850	2782	6305	5924	5118	2749	3855	3213	2317	1688	Senegal
90	Optical, photographic, cinematographic, measuring, checking, precision, medical or surgical ...	3180	2105	1835	1280	785	1210	1383	1384	1910	2095	1355	1313	Senegal
96	Miscellaneous manufactured articles	986	668	550	420	441	572	439	673	555	518	708	1246	Senegal
32	Tanning or dyeing extracts; tannins and their derivatives; dyes, pigments and other colouring ...	2928	2665	1448	2266	1462	2447	1849	1799	1382	1458	1558	937	Senegal
49	Printed books, newspapers, pictures and other products of the printing industry; manuscripts, ...	1676	898	1430	1063	1150	1235	1631	2042	1033	1465	1769	900	Senegal
06	Live trees and other plants; bulbs, roots and the like; cut flowers and ornamental foliage	138	393	674	584	2825	1299	245	797	484	886	696	847	Senegal
35	Albuminoidal substances; modified starches; glues; enzymes	1928	2029	1543	1460	1942	1033	842	840	555	530	646	711	Senegal
86	Railway or tramway locomotives, rolling stock and parts thereof; railway or tramway track fixtures ...	230	136	218	3749	2233	952	1086	510	3328	357	1677	689	Senegal
61	Articles of apparel and clothing accessories, knitted or crocheted	294	161	391	229	217	334	307	299	289	177	283	658	Senegal
97	Works of art, collectors' pieces and antiques	1386	1523	2214	1143	1145	2281	849	821	2913	733	1772	476	Senegal
93	Arms and ammunition; parts and accessories thereof	953	1752	637	683	1321	1555	126	829	285	1446	3	324	Senegal
83	Miscellaneous articles of base metal	191	281	355	492	570	315	101	80	275	433	343	295	Senegal
36	Explosives; pyrotechnic products; matches; pyrophoric alloys; certain combustible preparations	338	943	2591	2061	512	1226	938	262	836	1679	1053	295	Senegal
68	Articles of stone, plaster, cement, asbestos, mica or similar materials	2005	1727	534	149	49	165	381	358	512	313	370	267	Senegal
01	Live animals	506	272	159	228	371	220	252	345	340	174	187	254	Senegal
02	Meat and edible meat offal	704	634	532	268	1061	448	142	386	1288	2528	1803	221	Senegal
05	Products of animal origin, not elsewhere specified or included	167	123	298	298	124	234	96	256	169	59	105	209	Senegal
95	Toys, games and sports requisites; parts and accessories thereof	203	122	333	26	62	132	95	216	71	53	100	90	Senegal
65	Headgear and parts thereof	38	28	22	73	227	720	11	279	161	57	5	77	Senegal
42	Articles of leather; saddlery and harness; travel goods, handbags and similar containers; articles ...	224	191	197	217	308	286	183	171	194	94	73	68	Senegal
57	Carpets and other textile floor coverings	2	29	39	14	10	45	9	49	29	27	17	64	Senegal
91	Clocks and watches and parts thereof	113	76	132	138	187	110	61	47	1294	9	374	49	Senegal
92	Musical instruments; parts and accessories of such articles	114	122	102	51	84	142	99	54	116	176	58	35	Senegal
47	Pulp of wood or of other fibrous cellulosic material; recovered (waste and scrap) paper or ...	0	0	0	0	2	0	177	24	60	74	201	31	Senegal
14	Vegetable plaiting materials; vegetable products not elsewhere specified or included	13	0	6	7	3	11	77	19	55	35	42	31	Senegal
58	Special woven fabrics; tufted textile fabrics; lace; tapestries; trimmings; embroidery	1	16	8	6	6	10	2	52	23	0	28	25	Senegal
66	Umbrellas, sun umbrellas, walking sticks, seat-sticks, whips, riding-crops and parts thereof	58	0	10	7	0	30	0	1	0	2	3	3	Senegal
59	Impregnated, coated, covered or laminated textile fabrics; textile articles of a kind suitable ...	15	26	6	5	244	13	5	45	6	5	0	1	Senegal
60	Knitted or crocheted fabrics	0	0	0	3	10	0	0	0	0	0	3	0	Senegal
75	Nickel and articles thereof	55	0	0	0	0	0	64	5	98	0	3	0	Senegal
45	Cork and articles of cork	0	5	0	0	0	0	0	0	0	0	0	0	Senegal
43	Furskins and artificial fur; manufactures thereof	0	0	0	0	0	0	3	0	0	0	1	0	Senegal
50	Silk	0	0	0	0	1	0	10	0	1	0	0	0	Senegal
51	Wool, fine or coarse animal hair; horsehair yarn and woven fabric	0	0	1	0	30	0	0	19	15	0	0	0	Senegal
53	Other vegetable textile fibres; paper yarn and woven fabrics of paper yarn	87	0	0	0	0	0	1	0	0	31	69	0	Senegal
37	Photographic or cinematographic goods	1	38	10	2	19	0	7	1	4	0	1	0	Senegal
79	Zinc and articles thereof	36	33	97	134	90	127	35	0	55	0	9	0	Senegal
80	Tin and articles thereof	4	0	21	0	5	7	19	0	413	162	0	0	Senegal
TOTAL	All products	102142613	113883219	134906869	152461737	161480915	166504862	143844066	142606247	156992940	167923862	180870841	169657940	Turkey
87	Vehicles other than railway or tramway rolling stock, and parts and accessories thereof	12251734	13812677	15803438	15148114	17597373	18788121	17462623	19804384	23940852	26758524	26901683	22098148	Turkey
84	Machinery, mechanical appliances, nuclear reactors, boilers; parts thereof	8132787	9413411	11560990	11999300	14253875	14969266	12333493	12405009	13825494	15827680	17763898	16797839	Turkey
85	Electrical machinery and equipment and parts thereof; sound recorders and reproducers, television ...	6630701	7530130	8874013	9373078	10638897	10870623	8278952	7778954	8089893	8722854	9749875	9307365	Turkey
72	Iron and steel	7641010	8740067	11225329	11332482	9785707	9118083	6556742	6187046	8230403	11546435	10020302	8803211	Turkey
61	Articles of apparel and clothing accessories, knitted or crocheted	6925548	7731212	8385636	8418618	9362240	10127967	8927259	8855609	8840031	9043113	9206940	8387723	Turkey
39	Plastics and articles thereof	3093759	3716596	4580258	5012899	5769370	6277203	5358692	5027828	5474292	6042982	6805351	6971354	Turkey
71	Natural or cultured pearls, precious or semi-precious stones, precious metals, metals clad ...	5929025	3747222	3738763	16325215	7002594	7721879	11263502	12176573	10879244	7172319	7332841	6693436	Turkey
62	Articles of apparel and clothing accessories, not knitted or crocheted	4294831	4636123	5124460	5431268	6045828	6601176	5916617	5928894	5947844	6262454	6873999	6600585	Turkey
73	Articles of iron or steel	4545275	4850216	5748004	6093117	6290220	6447763	5465543	4967680	5598990	6533980	6689776	6363349	Turkey
08	Edible fruit and nuts; peel of citrus fruit or melons	3001898	3490879	3908880	3806416	4243759	4730483	4355444	3873872	3940007	3960605	4589918	4830425	Turkey
27	Mineral fuels, mineral oils and products of their distillation; bituminous substances; mineral ...	3921300	4469479	6539030	7708169	10117704	7500274	4518438	3207084	4327175	4411992	8449156	4715233	Turkey
94	Furniture; bedding, mattresses, mattress supports, cushions and similar stuffed furnishings; ...	1588862	1786405	2110174	2420661	2929315	3055601	2753346	2658941	2760343	3130600	3868865	3897049	Turkey
76	Aluminium and articles thereof	1399411	1916086	2285695	2251943	2383670	2636431	2370075	2238041	2512216	2995017	3116848	3060897	Turkey
25	Salt; sulphur; earths and stone; plastering materials, lime and cement	2164536	2509673	2465459	2480760	2738910	2556822	2252817	2191663	2572445	2616458	2784656	2801317	Turkey
40	Rubber and articles thereof	1468685	1895911	2593022	2424868	2535760	2670627	2165526	2203163	2494294	2822288	2905436	2656179	Turkey
57	Carpets and other textile floor coverings	1075386	1266828	1601798	1997286	2196705	2362678	2009356	1913135	2161753	2264274	2553899	2621045	Turkey
63	Other made-up textile articles; sets; worn clothing and worn textile articles; rags	1647817	1838582	2138565	1903514	2462588	2530247	1899404	1954767	2016726	2052497	2114705	2521487	Turkey
20	Preparations of vegetables, fruit, nuts or other parts of plants	1276305	1491356	1653520	1722134	1889699	2181170	2187068	1848571	1880096	1907840	2088314	2364552	Turkey
19	Preparations of cereals, flour, starch or milk; pastrycooks' products	678128	804479	1037190	1234702	1551287	1666164	1505559	1500914	1618271	1740265	1911098	2079037	Turkey
30	Pharmaceutical products	429061	558172	566797	661783	981587	1038515	878147	827082	875310	1172518	1430427	1826051	Turkey
48	Paper and paperboard; articles of paper pulp, of paper or of paperboard	1004769	1216836	1427254	1033095	1128334	1185312	1185514	1354573	1520374	1715786	1785426	1725418	Turkey
28	Inorganic chemicals; organic or inorganic compounds of precious metals, of rare-earth metals, ...	611669	930672	1216057	1266598	1202388	1337665	1248975	1087267	1316750	1847525	1876748	1648229	Turkey
74	Copper and articles thereof	597029	1063476	1391376	1384008	1421766	1349718	1169193	1114867	1441589	1793304	1524530	1581015	Turkey
60	Knitted or crocheted fabrics	978721	1265851	1482848	1560629	1683447	1701703	1440792	1498807	1553176	1535450	1546423	1510372	Turkey
68	Articles of stone, plaster, cement, asbestos, mica or similar materials	919023	1028277	1119838	1223766	1376588	1429773	1265455	1172111	1204075	1294704	1421935	1474613	Turkey
89	Ships, boats and floating structures	1826247	1108614	1271173	812835	1232867	1521445	996784	970379	1308252	917964	1225417	1473601	Turkey
52	Cotton	1278472	1449154	1922073	1785532	1969225	1933573	1703163	1720259	1717488	1826831	1732443	1463452	Turkey
07	Edible vegetables and certain roots and tubers	1020546	1107483	1070414	966063	1202384	1337173	1040415	942266	1001925	1085781	1271391	1434771	Turkey
15	Animal or vegetable fats and oils and their cleavage products; prepared edible fats; animal ...	511000	458236	1026173	1200983	1472716	1209865	994364	1045378	1033987	993404	1009156	1386489	Turkey
26	Ores, slag and ash	702169	1296437	1254682	1391576	1779830	1399033	1000959	929569	1397824	1325481	1229509	1384359	Turkey
54	Man-made filaments; strip and the like of man-made textile materials	1075024	1249851	1446859	1478091	1671701	1742893	1564127	1487190	1539114	1614077	1520882	1333523	Turkey
90	Optical, photographic, cinematographic, measuring, checking, precision, medical or surgical ...	331465	367134	448032	554929	852102	926969	724800	709485	809042	864645	1182722	1317769	Turkey
69	Ceramic products	675845	787063	882715	954301	1004692	1025223	875405	885159	969798	1079015	1166848	1247543	Turkey
11	Products of the milling industry; malt; starches; inulin; wheat gluten	665317	720213	1098380	1020558	1115721	1130687	1176203	1283235	1253547	1235094	1309671	1187771	Turkey
55	Man-made staple fibres	948939	1120571	1334818	1378287	1357187	1416989	1347765	1317138	1428745	1515060	1367602	1179049	Turkey
38	Miscellaneous chemical products	320298	399775	451639	496882	625988	597604	546394	562845	576320	685960	764666	1157492	Turkey
34	Soap, organic surface-active agents, washing preparations, lubricating preparations, artificial ...	647727	678101	767737	854429	947247	1048933	868140	759429	779818	803846	871131	1124841	Turkey
70	Glass and glassware	838628	903293	977705	955747	990533	1067728	1042242	953816	915857	966446	1097565	1052364	Turkey
03	Fish and crustaceans, molluscs and other aquatic invertebrates	318056	312928	395312	413747	523970	634283	647486	744680	797256	879590	976386	1014566	Turkey
83	Miscellaneous articles of base metal	504462	580920	695621	735081	832462	954277	761380	764423	836890	925418	950127	984537	Turkey
44	Wood and articles of wood; wood charcoal	510031	573203	652927	657954	715623	839070	692753	675924	762888	826635	874894	977025	Turkey
56	Wadding, felt and nonwovens; special yarns; twine, cordage, ropes and cables and articles thereof	227952	302555	406620	476730	515013	579283	570199	612604	646903	792574	814991	955758	Turkey
33	Essential oils and resinoids; perfumery, cosmetic or toilet preparations	418311	492007	558717	621208	806223	870720	695270	696446	762425	782920	928759	953269	Turkey
24	Tobacco and manufactured tobacco substitutes	757499	697027	670625	842432	1064952	1365170	918492	1006379	946199	1009621	909792	909214	Turkey
96	Miscellaneous manufactured articles	109467	118355	128444	796447	996172	1096318	970862	864344	872534	902366	933444	902163	Turkey
88	Aircraft, spacecraft, and parts thereof	285910	294359	343630	500686	778702	780742	688755	717532	1534418	917888	1197033	900428	Turkey
32	Tanning or dyeing extracts; tannins and their derivatives; dyes, pigments and other colouring ...	428770	532435	611672	701241	769357	784101	680874	641219	689309	792323	869353	891226	Turkey
64	Footwear, gaiters and the like; parts of such articles	289473	395624	441247	545923	747941	741312	670432	704374	765970	887627	958454	829448	Turkey
21	Miscellaneous edible preparations	541313	554692	715533	717680	820515	841722	695253	687189	687002	743228	763861	809339	Turkey
17	Sugars and sugar confectionery	294188	387421	474168	504689	634234	692235	557029	527767	585950	599941	641209	670795	Turkey
18	Cocoa and cocoa preparations	371683	430928	509920	550006	615985	642274	555704	476482	523155	601123	665890	653018	Turkey
93	Arms and ammunition; parts and accessories thereof	135699	187625	238017	335990	434322	513538	440855	416765	298247	301753	402891	652616	Turkey
04	Dairy produce; birds' eggs; natural honey; edible products of animal origin, not elsewhere ...	249877	303466	484057	545560	674139	755972	532707	592843	702199	747216	686689	612868	Turkey
29	Organic chemicals	347698	520499	545361	646889	676736	578297	473941	473413	657361	632111	652734	602028	Turkey
02	Meat and edible meat offal	154896	208012	390255	532489	727255	830060	444448	370877	542827	584596	639752	569938	Turkey
12	Oil seeds and oleaginous fruits; miscellaneous grains, seeds and fruit; industrial or medicinal ...	154652	182887	229737	238304	347230	364158	199972	373970	284741	332176	527647	446384	Turkey
23	Residues and waste from the food industries; prepared animal fodder	65867	27335	50980	131101	287188	271360	110588	129189	186824	238984	404814	415414	Turkey
99	Commodities not elsewhere specified	273935	166511	206394	148270	300049	556139	339131	372417	413825	303424	338946	394622	Turkey
58	Special woven fabrics; tufted textile fabrics; lace; tapestries; trimmings; embroidery	439158	479465	528843	548909	608780	592399	479873	485183	479262	454828	416822	378753	Turkey
31	Fertilisers	83679	205484	200598	147397	160201	259478	134435	146818	163173	251400	346290	375614	Turkey
22	Beverages, spirits and vinegar	180748	229518	258721	285734	314109	356303	315153	290645	320180	352573	362150	338347	Turkey
10	Cereals	204618	349247	110113	170358	320929	313392	108660	102770	109510	102890	345165	289970	Turkey
42	Articles of leather; saddlery and harness; travel goods, handbags and similar containers; articles ...	349507	370852	419895	410372	436777	445047	323480	294807	303105	322938	351246	284832	Turkey
09	Coffee, tea, maté and spices	97416	103447	110495	118694	185149	205283	168481	196162	178338	180685	211864	257132	Turkey
59	Impregnated, coated, covered or laminated textile fabrics; textile articles of a kind suitable ...	249996	286664	352834	299011	334309	337307	302988	293487	298905	314815	297718	256572	Turkey
82	Tools, implements, cutlery, spoons and forks, of base metal; parts thereof of base metal	115286	158685	179685	179016	227800	270758	246746	213941	243589	243869	269683	255321	Turkey
35	Albuminoidal substances; modified starches; glues; enzymes	75112	94365	135571	183444	199079	184282	175529	182491	196389	191862	235358	250994	Turkey
41	Raw hides and skins (other than furskins) and leather	93631	115731	138608	161317	222401	243893	181134	184224	210014	210200	234100	155984	Turkey
81	Other base metals; cermets; articles thereof	4866	8262	13332	14136	38745	58913	8118	11465	23249	25932	101397	147510	Turkey
86	Railway or tramway locomotives, rolling stock and parts thereof; railway or tramway track fixtures ...	86099	16841	115181	127016	96614	74755	94904	50735	85304	79145	142993	145736	Turkey
49	Printed books, newspapers, pictures and other products of the printing industry; manuscripts, ...	84745	84248	89759	88778	95301	96447	87160	75075	79935	99766	124183	132344	Turkey
95	Toys, games and sports requisites; parts and accessories thereof	52004	65858	81281	98430	121643	136660	117717	107902	125131	138999	148547	128870	Turkey
16	Preparations of meat, of fish or of crustaceans, molluscs or other aquatic invertebrates	39998	55773	65446	74530	99604	111035	83176	74195	109439	130772	128166	128266	Turkey
75	Nickel and articles thereof	6035	11039	9678	25849	26763	21263	12007	23909	45763	75326	77668	107345	Turkey
06	Live trees and other plants; bulbs, roots and the like; cut flowers and ornamental foliage	48613	56053	75957	73028	78117	83498	77429	81613	85512	99296	107440	106768	Turkey
43	Furskins and artificial fur; manufactures thereof	104878	174587	261903	273937	290219	242131	136686	123751	155902	173949	161772	101824	Turkey
01	Live animals	24366	7322	6215	8142	13464	26720	34473	27974	34673	57966	84612	83406	Turkey
05	Products of animal origin, not elsewhere specified or included	31531	33747	45899	56835	64096	74503	54238	50643	54639	59963	67631	79219	Turkey
51	Wool, fine or coarse animal hair; horsehair yarn and woven fabric	152938	173219	204156	195288	189398	187669	154497	122161	149078	154080	94048	68043	Turkey
47	Pulp of wood or of other fibrous cellulosic material; recovered (waste and scrap) paper or ...	5745	14612	27798	8478	29614	35219	24259	23991	21826	32568	57850	60712	Turkey
65	Headgear and parts thereof	11524	14303	16960	21169	26855	34425	31092	31584	37764	40718	42340	53137	Turkey
53	Other vegetable textile fibres; paper yarn and woven fabrics of paper yarn	18561	21755	24796	23733	25914	24415	22131	29493	32383	44498	48717	45138	Turkey
91	Clocks and watches and parts thereof	14657	20293	18938	20983	24576	35881	34915	34194	45886	52957	44970	34635	Turkey
78	Lead and articles thereof	4596	6411	7662	9730	14923	15826	18738	26827	25718	22092	29517	29271	Turkey
13	Lac; gums, resins and other vegetable saps and extracts	1525	4683	6636	8403	10607	9783	9107	10283	12003	16387	19122	28925	Turkey
36	Explosives; pyrotechnic products; matches; pyrophoric alloys; certain combustible preparations	11952	15581	18306	23575	33754	37889	30264	27101	24543	18570	27044	23003	Turkey
37	Photographic or cinematographic goods	11298	14043	17646	25437	33925	24274	12523	11480	13682	11510	19650	14279	Turkey
14	Vegetable plaiting materials; vegetable products not elsewhere specified or included	11134	23340	32852	28417	20765	13226	17778	17742	20381	13419	13239	13390	Turkey
97	Works of art, collectors' pieces and antiques	2054	2956	4599	2038	15127	4007	4135	7711	9229	19675	14123	10948	Turkey
92	Musical instruments; parts and accessories of such articles	8024	8749	9094	9411	9415	10207	9166	9561	9484	11302	11158	10858	Turkey
50	Silk	4077	3700	3538	3017	3421	2755	2626	2441	3376	2661	3157	9094	Turkey
66	Umbrellas, sun umbrellas, walking sticks, seat-sticks, whips, riding-crops and parts thereof	10487	11261	12420	7249	5346	5278	4535	5233	5381	6646	7421	7596	Turkey
80	Tin and articles thereof	520	2302	2163	1198	1479	1251	1158	1970	1748	2104	7060	7375	Turkey
79	Zinc and articles thereof	10846	11410	16812	18549	17599	18906	22620	25257	23786	15921	10946	7153	Turkey
67	Prepared feathers and down and articles made of feathers or of down; artificial flowers; articles ...	787	1135	1008	1619	2427	1860	2013	2765	2543	2900	3779	3214	Turkey
46	Manufactures of straw, of esparto or of other plaiting materials; basketware and wickerwork	462	619	725	936	1140	2627	4022	6412	1201	1466	1525	1954	Turkey
45	Cork and articles of cork	452	330	715	512	661	887	679	436	634	636	648	802	Turkey
TOTAL	All products	1056712100	1278099187	1481682200	1544932000	1577587300	1619742900	1503328350	1451459684	1547195403	1665688484	1642820352	1424934919	USA
84	Machinery, mechanical appliances, nuclear reactors, boilers; parts thereof	153167236	182902861	205826160	215180488	213482188	219766259	206322326	190945121	202065162	213370247	206126759	182709808	USA
85	Electrical machinery and equipment and parts thereof; sound recorders and reproducers, television ...	124872442	151776704	159468543	162434694	165841746	172368327	170010927	166964105	174505226	176508425	173001469	162785012	USA
27	Mineral fuels, mineral oils and products of their distillation; bituminous substances; mineral ...	54936720	81692032	130566668	137332529	148872444	155608248	104781536	94005494	139571912	192249974	199543997	151164069	USA
87	Vehicles other than railway or tramway rolling stock, and parts and accessories thereof	73601862	99148693	120011781	133078053	134084552	135972388	127366637	124702177	130406682	130678694	133834668	105560729	USA
90	Optical, photographic, cinematographic, measuring, checking, precision, medical or surgical ...	65076438	73960067	79383779	83367062	84353330	84966350	83433294	82016451	83639334	89651535	90828117	83222109	USA
88	Aircraft, spacecraft, and parts thereof	82957527	79617923	87757246	104440080	114898028	125186257	131661791	134742238	131120839	139442044	136519380	81293548	USA
39	Plastics and articles thereof	42795066	53625263	58743605	59006434	60980811	63037374	60347504	58628345	61907709	66561665	65004106	60205864	USA
71	Natural or cultured pearls, precious or semi-precious stones, precious metals, metals clad ...	38414676	51742636	71785843	72106219	71641926	64089621	58743797	57780402	60268348	63804887	59700321	59817926	USA
30	Pharmaceutical products	40668566	40788230	38341461	40129283	39708541	43995520	47094047	46828627	44936422	48422459	53154570	53749642	USA
99	Commodities not elsewhere specified	30750044	40373872	39377993	40638745	42135938	43237139	41444087	40131229	42447656	46181163	46707299	40973897	USA
29	Organic chemicals	30796713	40928207	45682440	46079295	46600465	42340487	38703088	33956461	36278625	40242211	38889529	33567334	USA
38	Miscellaneous chemical products	18126581	21197593	23881042	25327714	27028664	27259322	25916666	25317150	27678240	30305676	30635625	31256429	USA
12	Oil seeds and oleaginous fruits; miscellaneous grains, seeds and fruit; industrial or medicinal ...	19558426	21959179	21231784	29688507	26955339	28862025	23599315	27718131	26387756	22411370	23906961	30833296	USA
10	Cereals	17419347	20036820	28347941	20616227	20300976	22850742	18816091	18938198	18613044	21021758	16923853	19338911	USA
02	Meat and edible meat offal	10566930	12051903	15357261	16096227	16276932	17570517	14288343	14657760	16398642	17266108	17662209	18147642	USA
73	Articles of iron or steel	13797469	16197384	18519857	21154320	22056098	22628933	19636378	17517569	18440969	19261452	18701069	16026527	USA
08	Edible fruit and nuts; peel of citrus fruit or melons	8708545	10142479	11767712	13263744	14533192	14858265	14458787	14054421	14880593	14697875	15083773	14303253	USA
48	Paper and paperboard; articles of paper pulp, of paper or of paperboard	13674318	15784737	16945425	16057949	16400341	16337334	15696614	14864640	15766059	16397732	15062227	13794697	USA
33	Essential oils and resinoids; perfumery, cosmetic or toilet preparations	8087629	9094029	9633633	10452105	11133099	11551622	11807215	12049254	12954788	13614181	13837081	12345177	USA
72	Iron and steel	15399594	19825320	25361376	22838006	19681569	18565400	14545580	12871594	16105430	16488846	14347291	12299160	USA
40	Rubber and articles thereof	9607179	12121181	14889441	15724935	14789369	14923993	13617991	12595899	13438262	13983607	13226693	11191664	USA
28	Inorganic chemicals; organic or inorganic compounds of precious metals, of rare-earth metals, ...	10963755	12853530	15295629	13658258	12435825	12665078	12364685	11314401	12389990	12476050	11449253	11039947	USA
23	Residues and waste from the food industries; prepared animal fodder	7165913	8332980	8550403	9908645	11780243	11957905	11262749	9892612	9567869	11124889	10371685	10906826	USA
76	Aluminium and articles thereof	8362993	10625016	12975642	12783556	13053200	12736128	12046082	12237317	11588064	12583681	10933314	9380978	USA
21	Miscellaneous edible preparations	4994052	5535698	6253897	7118792	8006721	8344424	8242835	8634511	8508502	8919847	9420239	9313172	USA
